{
  "id": "DEC-0009",
  "date": "2026-10-17",
  "subject": "Zaakceptowano zakres analizy i projektu naprawy alarmow glikemii dla Issue #28",
  "status": "ACCEPTED",
  "decision": "Product Owner akceptuje przygotowanie analizy technicznej, docelowej architektury, wymagan bezpieczenstwa, kryteriow akceptacji oraz planu testow dla alarmow glikemii. Decyzja nie akceptuje implementacji zmian zachowania alarmow.",
  "reason": "Issue #28 zostalo sklasyfikowane jako SAFETY_GAP candidate; przed wdrozeniem konieczne jest rozdzielenie potwierdzonych defektow od hipotez i przygotowanie testow urzadzeniowych.",
  "evidence": [
    "GitHub Issue #28",
    "INBOX-GH-000028",
    "CAND-INBOX-GH-000028",
    "Analiza kodu: GlucoseAlertCoordinator nie jest podlaczony do przeplywu danych"
  ],
  "counterargument": "Sama analiza nie poprawia natychmiast zachowania alarmow na urzadzeniach koncowych.",
  "revisit_condition": "Po dostarczeniu raportu projektowego i decyzji PO o uruchomieniu implementacji.",
  "related_requirements": []
}

